INITIALIZATION
CREATE TABLE JOIN_TABLE_1(ID INT, NAME CHAR);
SUCCESS
CREATE TABLE JOIN_TABLE_2(ID INT, NUM INT);
SUCCESS
CREATE TABLE JOIN_TABLE_3(ID INT, NUM2 INT);
SUCCESS

INSERT INTO JOIN_TABLE_1 VALUES (1, 'A');
SUCCESS
INSERT INTO JOIN_TABLE_1 VALUES (2, 'B');
SUCCESS
INSERT INTO JOIN_TABLE_1 VALUES (3, 'C');
SUCCESS

INSERT INTO JOIN_TABLE_2 VALUES (1, 2);
SUCCESS
INSERT INTO JOIN_TABLE_2 VALUES (2, 15);
SUCCESS
INSERT INTO JOIN_TABLE_2 VALUES (3, 100);
SUCCESS
INSERT INTO JOIN_TABLE_2 VALUES (4, 100);
SUCCESS
INSERT INTO JOIN_TABLE_2 VALUES (5, 100);
SUCCESS
INSERT INTO JOIN_TABLE_2 VALUES (6, 100);
SUCCESS
INSERT INTO JOIN_TABLE_2 VALUES (7, 100);
SUCCESS
INSERT INTO JOIN_TABLE_2 VALUES (8, 100);
SUCCESS
INSERT INTO JOIN_TABLE_3 VALUES (1, 120);
SUCCESS
INSERT INTO JOIN_TABLE_3 VALUES (3, 800);
SUCCESS

SET USE_CASCADE=0;
SUCCESS
SET HASH_JOIN=0;
SUCCESS

ENSURE:NLJ SELECT * FROM JOIN_TABLE_1 INNER JOIN JOIN_TABLE_2 ON JOIN_TABLE_1.ID = JOIN_TABLE_2.ID WHERE JOIN_TABLE_2.ID=1;
SELECT * FROM JOIN_TABLE_1 INNER JOIN JOIN_TABLE_2 ON JOIN_TABLE_1.ID = JOIN_TABLE_2.ID WHERE JOIN_TABLE_2.ID=1;
ID | NAME | ID | NUM
1 | A | 1 | 2

ENSURE:NLJ SELECT * FROM JOIN_TABLE_1, JOIN_TABLE_2 WHERE JOIN_TABLE_1.ID = JOIN_TABLE_2.ID AND JOIN_TABLE_2.ID=1;
SELECT * FROM JOIN_TABLE_1, JOIN_TABLE_2 WHERE JOIN_TABLE_1.ID = JOIN_TABLE_2.ID AND JOIN_TABLE_2.ID=1;
ID | NAME | ID | NUM
1 | A | 1 | 2

ENSURE:NLJ*2 SELECT * FROM JOIN_TABLE_1, JOIN_TABLE_2, JOIN_TABLE_3 WHERE JOIN_TABLE_1.ID = JOIN_TABLE_2.ID AND JOIN_TABLE_2.ID=JOIN_TABLE_3.ID AND JOIN_TABLE_2.ID=1;
SELECT * FROM JOIN_TABLE_1, JOIN_TABLE_2, JOIN_TABLE_3 WHERE JOIN_TABLE_1.ID = JOIN_TABLE_2.ID AND JOIN_TABLE_2.ID=JOIN_TABLE_3.ID AND JOIN_TABLE_2.ID=1;
ID | NAME | ID | NUM | ID | NUM2
1 | A | 1 | 2 | 1 | 120

SET HASH_JOIN=1;
SUCCESS

ENSURE:HASHJOIN SELECT * FROM JOIN_TABLE_1 INNER JOIN JOIN_TABLE_2 ON JOIN_TABLE_1.ID = JOIN_TABLE_2.ID WHERE JOIN_TABLE_2.ID=1;
SELECT * FROM JOIN_TABLE_1 INNER JOIN JOIN_TABLE_2 ON JOIN_TABLE_1.ID = JOIN_TABLE_2.ID WHERE JOIN_TABLE_2.ID=1;
ID | NAME | ID | NUM
1 | A | 1 | 2

ENSURE:HASHJOIN SELECT * FROM JOIN_TABLE_1, JOIN_TABLE_2 WHERE JOIN_TABLE_1.ID = JOIN_TABLE_2.ID AND JOIN_TABLE_2.ID=1;
SELECT * FROM JOIN_TABLE_1, JOIN_TABLE_2 WHERE JOIN_TABLE_1.ID = JOIN_TABLE_2.ID AND JOIN_TABLE_2.ID=1;
ID | NAME | ID | NUM
1 | A | 1 | 2

ENSURE:HASHJOIN*2 SELECT * FROM JOIN_TABLE_1, JOIN_TABLE_2, JOIN_TABLE_3 WHERE JOIN_TABLE_1.ID = JOIN_TABLE_2.ID AND JOIN_TABLE_2.ID=JOIN_TABLE_3.ID AND JOIN_TABLE_2.ID=1;
SELECT * FROM JOIN_TABLE_1, JOIN_TABLE_2, JOIN_TABLE_3 WHERE JOIN_TABLE_1.ID = JOIN_TABLE_2.ID AND JOIN_TABLE_2.ID=JOIN_TABLE_3.ID AND JOIN_TABLE_2.ID=1;
ID | NAME | ID | NUM | ID | NUM2
1 | A | 1 | 2 | 1 | 120

ENSURE:HASHJOIN SELECT * FROM JOIN_TABLE_1, JOIN_TABLE_2, JOIN_TABLE_3 WHERE JOIN_TABLE_1.ID = JOIN_TABLE_2.ID AND JOIN_TABLE_2.ID>JOIN_TABLE_3.ID AND JOIN_TABLE_2.ID=1;
ENSURE:NLJ SELECT * FROM JOIN_TABLE_1, JOIN_TABLE_2, JOIN_TABLE_3 WHERE JOIN_TABLE_1.ID = JOIN_TABLE_2.ID AND JOIN_TABLE_2.ID>JOIN_TABLE_3.ID AND JOIN_TABLE_2.ID=1;
SELECT * FROM JOIN_TABLE_1, JOIN_TABLE_2, JOIN_TABLE_3 WHERE JOIN_TABLE_1.ID = JOIN_TABLE_2.ID AND JOIN_TABLE_2.ID>JOIN_TABLE_3.ID AND JOIN_TABLE_2.ID=1;
ID | NAME | ID | NUM | ID | NUM2

ENSURE:HASHJOIN SELECT * FROM JOIN_TABLE_1, JOIN_TABLE_2, JOIN_TABLE_3 WHERE JOIN_TABLE_1.ID = JOIN_TABLE_2.ID AND JOIN_TABLE_2.ID>JOIN_TABLE_3.ID AND JOIN_TABLE_2.ID=1 AND JOIN_TABLE_2.ID>0;
SELECT * FROM JOIN_TABLE_1, JOIN_TABLE_2, JOIN_TABLE_3 WHERE JOIN_TABLE_1.ID = JOIN_TABLE_2.ID AND JOIN_TABLE_2.ID>JOIN_TABLE_3.ID AND JOIN_TABLE_2.ID=1 AND JOIN_TABLE_2.ID>0;
ID | NAME | ID | NUM | ID | NUM2

DELETE FROM JOIN_TABLE_1;
SUCCESS
DELETE FROM JOIN_TABLE_2;
SUCCESS
DELETE FROM JOIN_TABLE_3;
SUCCESS

SET USE_CASCADE=1;
SUCCESS

INSERT INTO JOIN_TABLE_1 VALUES (1, 'A');
SUCCESS
INSERT INTO JOIN_TABLE_2 VALUES (1, 2);
SUCCESS
INSERT INTO JOIN_TABLE_3 VALUES (1, 120);
SUCCESS
INSERT INTO JOIN_TABLE_3 VALUES (3, 800);
SUCCESS

ANALYZE TABLE JOIN_TABLE_1;
SUCCESS
ANALYZE TABLE JOIN_TABLE_2;
SUCCESS
ANALYZE TABLE JOIN_TABLE_3;
SUCCESS

ENSURE:NLJ SELECT * FROM JOIN_TABLE_1,JOIN_TABLE_2 WHERE JOIN_TABLE_1.ID = JOIN_TABLE_2.ID;
SELECT * FROM JOIN_TABLE_1,JOIN_TABLE_2 WHERE JOIN_TABLE_1.ID = JOIN_TABLE_2.ID;
ID | NAME | ID | NUM
1 | A | 1 | 2

INSERT INTO JOIN_TABLE_1 VALUES (2, 'B');
SUCCESS
INSERT INTO JOIN_TABLE_1 VALUES (3, 'C');
SUCCESS
INSERT INTO JOIN_TABLE_2 VALUES (2, 15);
SUCCESS
INSERT INTO JOIN_TABLE_2 VALUES (3, 100);
SUCCESS
INSERT INTO JOIN_TABLE_2 VALUES (4, 100);
SUCCESS
INSERT INTO JOIN_TABLE_2 VALUES (5, 100);
SUCCESS
INSERT INTO JOIN_TABLE_2 VALUES (6, 100);
SUCCESS
INSERT INTO JOIN_TABLE_2 VALUES (7, 100);
SUCCESS
INSERT INTO JOIN_TABLE_2 VALUES (8, 100);
SUCCESS

ANALYZE TABLE JOIN_TABLE_1;
SUCCESS
ANALYZE TABLE JOIN_TABLE_2;
SUCCESS
ANALYZE TABLE JOIN_TABLE_3;
SUCCESS

ENSURE:HASHJOIN SELECT * FROM JOIN_TABLE_1,JOIN_TABLE_2 WHERE JOIN_TABLE_1.ID = JOIN_TABLE_2.ID;
SELECT * FROM JOIN_TABLE_1,JOIN_TABLE_2 WHERE JOIN_TABLE_1.ID = JOIN_TABLE_2.ID;
ID | NAME | ID | NUM
1 | A | 1 | 2
2 | B | 2 | 15
3 | C | 3 | 100

ENSURE:NLJ SELECT * FROM JOIN_TABLE_1,JOIN_TABLE_2 WHERE JOIN_TABLE_1.ID > JOIN_TABLE_2.ID;
SELECT * FROM JOIN_TABLE_1,JOIN_TABLE_2 WHERE JOIN_TABLE_1.ID > JOIN_TABLE_2.ID;
ID | NAME | ID | NUM
2 | B | 1 | 2
3 | C | 1 | 2
3 | C | 2 | 15

ENSURE:HASHJOIN*2 SELECT * FROM JOIN_TABLE_1, JOIN_TABLE_2, JOIN_TABLE_3 WHERE JOIN_TABLE_1.ID = JOIN_TABLE_2.ID AND JOIN_TABLE_2.ID=JOIN_TABLE_3.ID;
SELECT * FROM JOIN_TABLE_1, JOIN_TABLE_2, JOIN_TABLE_3 WHERE JOIN_TABLE_1.ID = JOIN_TABLE_2.ID AND JOIN_TABLE_2.ID=JOIN_TABLE_3.ID;
ID | NAME | ID | NUM | ID | NUM2
1 | A | 1 | 2 | 1 | 120
3 | C | 3 | 100 | 3 | 800

ENSURE:HASHJOIN SELECT * FROM JOIN_TABLE_1, JOIN_TABLE_2, JOIN_TABLE_3 WHERE JOIN_TABLE_1.ID = JOIN_TABLE_2.ID AND JOIN_TABLE_2.ID<JOIN_TABLE_3.ID;
ENSURE:NLJ SELECT * FROM JOIN_TABLE_1, JOIN_TABLE_2, JOIN_TABLE_3 WHERE JOIN_TABLE_1.ID = JOIN_TABLE_2.ID AND JOIN_TABLE_2.ID<JOIN_TABLE_3.ID;
SELECT * FROM JOIN_TABLE_1, JOIN_TABLE_2, JOIN_TABLE_3 WHERE JOIN_TABLE_1.ID = JOIN_TABLE_2.ID AND JOIN_TABLE_2.ID<JOIN_TABLE_3.ID;
ID | NAME | ID | NUM | ID | NUM2
1 | A | 1 | 2 | 3 | 800
2 | B | 2 | 15 | 3 | 800
